{
  "id": "dis:ncit:C3704",
  "conceptType": "Disease",
  "name": "Dedifferentiated Liposarcoma",
  "mappings": [
    {
      "relation": "exactMatch",
      "coding": {
        "id": "coding:oncotree:DDLS",
        "code": "DDLS",
        "name": "Dedifferentiated Liposarcoma",
        "system": "https://oncotree.mskcc.org",
        "systemVersion": "oncotree_2025_10_03",
        "iris": [
          "https://oncotree.mskcc.org/?version=oncotree_2025_10_03&field=NAME&search=Dedifferentiated+Liposarcoma+%28DDLS%29"
        ]
      }
    }
  ],
  "extensions": [
    {
      "name": "solid_tumor",
      "value": true,
      "description": "Boolean value for if this tumor type is categorized as a solid tumor."
    }
  ],
  "primaryCoding": {
    "id": "coding:ncit:C3704",
    "code": "C3704",
    "name": "Dedifferentiated Liposarcoma",
    "system": "https://evsexplore.semantics.cancer.gov",
    "systemVersion": "26.08e",
    "iris": [
      "https://evsexplore.semantics.cancer.gov/evsexplore/concept/ncit/C3704"
    ]
  }
}