{
  "id": "dis:oncotree:TGCT",
  "conceptType": "Disease",
  "name": "Testicular Germ Cell Tumors",
  "mappings": [],
  "extensions": [
    {
      "name": "solid_tumor",
      "value": true,
      "description": "Boolean value for if this tumor type is categorized as a solid tumor."
    }
  ],
  "primaryCoding": {
    "id": "coding:oncotree:TGCT",
    "code": "TGCT",
    "name": "Testicular Germ Cell Tumors",
    "system": "https://oncotree.mskcc.org",
    "systemVersion": "oncotree_2021_11_02",
    "iris": [
      "https://oncotree.mskcc.org/?version=oncotree_2021_11_02&field=CODE&search=TGCT"
    ]
  }
}