{
  "id": "dis:oncotree:MBN",
  "conceptType": "Disease",
  "name": "Mature B-Cell Neoplasms",
  "mappings": [],
  "extensions": [
    {
      "name": "solid_tumor",
      "value": false,
      "description": "Boolean value for if this tumor type is categorized as a solid tumor."
    }
  ],
  "primaryCoding": {
    "id": "coding:oncotree:MBN",
    "code": "MBN",
    "name": "Mature B-Cell Neoplasms",
    "system": "https://oncotree.mskcc.org",
    "systemVersion": "oncotree_2021_11_02",
    "iris": [
      "https://oncotree.mskcc.org/?version=oncotree_2021_11_02&field=CODE&search=MBN"
    ]
  }
}